<?xml version="1.0" encoding="UTF-8" standalone="no"?><tns:Airlines xmlns:tns="http://www.example.org/Airlines" xmlns:xsi="http://www.w3.org/2001/XMLSchema-instance" xsi:schemaLocation="http://www.example.org/Airlines Airlines.xsd"><Airline counrty="England" name="airline1"><Schedule><FlightSegment ArrivalDateTime="2016-03-08T07:16:00.000+03:00" DepartureDateTime="2016-03-08T06:10:00.000+03:00" FlightNumber="2818"><DepartureAirport CodeContext="IATA" LocationCode="JFK"/><ArrivalAirport CodeContext="IATA" LocationCode="BOS"/><OperatingAirline Code="B6"/></FlightSegment><FlightSegment ArrivalDateTime="2016-03-18T07:16:00.000+03:00" DepartureDateTime="2016-03-18T06:15:00.000+03:00" FlightNumber="4858"><DepartureAirport CodeContext="TDP" LocationCode="JDK"/><ArrivalAirport CodeContext="TDP" LocationCode="BOS"/><OperatingAirline Code="ADT"/></FlightSegment></Schedule></Airline><Airline counrty="American" name="airline2"><Schedule><FlightSegment ArrivalDateTime="2016-03-18T07:16:00.000+03:00" DepartureDateTime="2016-03-18T06:15:00.000+03:00" FlightNumber="2858"><DepartureAirport CodeContext="TDP" LocationCode="JDK"/><ArrivalAirport CodeContext="TDP" LocationCode="BOS"/><OperatingAirline Code="ADT"/></FlightSegment></Schedule></Airline></tns:Airlines>